cid;new_cid;channel_id;LANGUAGE;title;description;Provider_id;author;release_date;episode_count;play_count;sub_count;comment_count;categories;keywords;tags;rss_url;small_cover_url;big_cover_url
479484;0;3f316ad6f10b78bb6cef258654ee4de9cabdac3e;FR (FR);Psychoses;Chaleureuse, cultivée, marrante, Agathe a 27 ans et souffre de délires schizophrènes. Lors de son rendez-vous chez le psy, elle raconte les voix dans sa tête, mais aussi ses lectures et sa vie 'normale'. Agathe nous ressemble. Une série documentaire sur l'ordinaire de la folie.;;ARTE Radio;2007-06-13 00:00:00 UTC;5;143;47;0;Portraits;News & Politics,Government & Organizations,Society & Culture;evst-user-add;https://www.arteradio.com/xml_sound_serie?seriename=PSYCHOSES;https://www.arteradio.com/sites/default/files/pictures/Bonbons.jpg;https://www.arteradio.com/sites/default/files/pictures/Bonbons.jpg
409232;474822;dfd0d7818e94d6c3360d9457c8c78e358d9e84e1;FR (FR);Le mike et l'enclume;Le rendez-vous mensuel de la culture rap animé par Jérôme Larcin. Bons sons, critiques affûtées libres et bonne humeur : un podcast ARTE Radio.;Natif;ARTE Radio;2018-04-24 12:03:42 UTC;35;38;1;0;Musique;News & Politics,Government & Organizations,Society & Culture;;"http://arteradio.com/xml_sound_serie?seriename=""LE%20MIKE%20ET%20L'ENCLUME""";http://is5.mzstatic.com/image/thumb/Music71/v4/f1/86/6c/f1866ca7-4b69-4177-634e-bc694568daa0/source/100x100bb.jpg;http://is5.mzstatic.com/image/thumb/Music71/v4/f1/86/6c/f1866ca7-4b69-4177-634e-bc694568daa0/source/600x600bb.jpg
466110;480957;54b48de889b91293f876cc934b351a5bf50c0c2f;FR (FR);Pelles et râteaux;Une collection de témoignages intimes autour du délicat moment du passage à l’acte. Allez-vous embrasser ou tourner la tête ? Et des années plus tard, raconter votre meilleure pelle ou votre pire râteau ? Dix épisodes de 2 à 4 minutes comprenant chacun deux récits en miroir. Soit vingt moments décisifs à partager. Une production de Jeanne Robet pour ARTE Radio.;Radio;ARTE Radio;2016-09-27 12:06:53 UTC;10;1;7;0;Sexualité;News & Politics,Government & Organizations,Society & Culture;;http://www.arteradio.com/xml_sound_serie?seriename=PELLES%20ET%20RÂTEAUX;http://is1.mzstatic.com/image/thumb/Music19/v4/e9/8d/d8/e98dd82d-6a7e-ec1d-9f02-4f25f2bf4b36/source/100x100bb.jpg;http://is1.mzstatic.com/image/thumb/Music19/v4/e9/8d/d8/e98dd82d-6a7e-ec1d-9f02-4f25f2bf4b36/source/600x600bb.jpg
466603;482005;8db61c9b9a3536cfd16402a77a4e7cfb76a96a57;FR (FR);Cent façons de disparaître;Cernée par les ondes, surveillée par les réseaux, une jeune femme rêve de disparaître. Mais il n’y a pas d’application pour ça... Une fiction rebelle de Claire Richard tapie dans l'ombre numérique pour ARTE Radio.;Radio;ARTE Radio;;5;1;0;0;Littérature;News & Politics,Government & Organizations,Society & Culture;;"http://www.arteradio.com/xml_sound_serie?seriename=""CENT%20FAÇONS%20DE%20DISPARAÎTRE""";http://is4.mzstatic.com/image/thumb/Music122/v4/73/0a/1e/730a1ea0-5f9d-045d-333f-d889ebfe985c/source/100x100bb.jpg;http://is4.mzstatic.com/image/thumb/Music122/v4/73/0a/1e/730a1ea0-5f9d-045d-333f-d889ebfe985c/source/600x600bb.jpg
466499;998218;cb7909d839c9c25b4105b67b39b0cd971579964a;FR (FR);Le vaisseau spécial;Gaël, jeune chômeur breton, est enlevé par Grischkor et Iga, un couple d'extraterrestres un peu cons. La première comédie sonore de Frank Bellocq (Groland), une saga galactique en hommage aux feuilletons radio;Radio;ARTE Radio;2009-12-22 00:00:00 UTC;12;0;1;0;Littérature;News & Politics,Government & Organizations,Society & Culture;;"http://www.arteradio.com/xml_sound_serie?seriename=""LE%20VAISSEAU%20SPÉCIAL""";http://is4.mzstatic.com/image/thumb/Music111/v4/bd/12/8e/bd128ed9-a260-4116-2e81-c650fd511303/source/100x100bb.jpg;http://is4.mzstatic.com/image/thumb/Music111/v4/bd/12/8e/bd128ed9-a260-4116-2e81-c650fd511303/source/600x600bb.jpg
466113;474821;aee500918c71352f6bf93e7d51833aaee5be4cbc;FR (FR);Flicopolis;Enquêtes, indics, interpellations… Un officier des stups raconte son quotidien dans l’univers du trafic de drogue en banlieue parisienne. Une production de Merry Royer pour ARTE Radio.;Radio;ARTE Radio;2016-06-28 07:19:17 UTC;8;0;1;0;Portraits;News & Politics,Government & Organizations,Society & Culture;;http://www.arteradio.com/xml_sound_serie?seriename=FLICOPOLIS;http://is4.mzstatic.com/image/thumb/Music111/v4/50/3e/4d/503e4d05-1892-9f59-8526-c1388c410fe3/source/100x100bb.jpg;http://is4.mzstatic.com/image/thumb/Music111/v4/50/3e/4d/503e4d05-1892-9f59-8526-c1388c410fe3/source/600x600bb.jpg
466036;479319;9df189eec61d0f826d08a53f7c5354a2061eb678;FR (FR);A la campagne;Après 15 ans à Paris et en banlieue, Emma s'installe à la campagne. Nouvelle école, nouveaux voisins, nouvelle vie : elle nous racontera tout. Premier épisode : la rentrée des écoliers.;Radio;ARTE Radio;2009-06-23 00:00:00 UTC;7;0;1;0;Portraits;News & Politics,Government & Organizations,Society & Culture;;http://www.arteradio.com/xml_sound_serie?seriename=A%20LA%20CAMPAGNE;https://www.arteradio.com/sites/default/files/pictures/Bonbons.jpg;https://www.arteradio.com/sites/default/files/pictures/Bonbons.jpg
86904;0;27fcc59f03be5db52d60ce87483b914515e71f9f;FR (FR);Afrique : 50 ans d'indépendance - Tchad;Le podcast du web-documentaire d'ARTE Reportage consacré aux indépendances de l'Afrique.;Radio;ARTE Reportage;2000-03-01 19:37:00 UTC;38;19;6;0;Histoire;indépendance,TV & Film,ARTE,Reportage,TV & Film/(None),Tchad,Afrique,(None);evst-user-add;http://feeds.feedburner.com/artereportage-afrique-20;https://is4-ssl.mzstatic.com/image/thumb/Music4/v4/8c/d6/d4/8cd6d4cf-06b2-10d6-f2ac-22c81613e0a1/source/100x100bb.jpg;https://is4-ssl.mzstatic.com/image/thumb/Music4/v4/8c/d6/d4/8cd6d4cf-06b2-10d6-f2ac-22c81613e0a1/source/600x600bb.jpg
391162;0;818098b2e5c278c0871e7187b04587fbfbf29940;FR (FR);Le Réveil Chérie de Vincent Cerutti;"Retrouvez tous les podcasts de l'émission ""Le Réveil Chérie de Vincent Cerutti"" !";;ChérieFm;2018-03-14 23:00:00 UTC;1905;76;27;0;Fun;Music,Vincent,Cerutti,Chérie,Réveil;evst-user-add;;http://is1.mzstatic.com/image/thumb/Music71/v4/65/88/97/65889767-4a74-f3ee-0da9-15972f6562d1/source/100x100bb.jpg;http://is1.mzstatic.com/image/thumb/Music71/v4/65/88/97/65889767-4a74-f3ee-0da9-15972f6562d1/source/600x600bb.jpg
371860;372213;ba9a384169c85fd8a9fde5705714ece3c0ee8af3;FR (FR);Ca pique mais c'est bon - Anne Roumanoff;Anne Roumanoff croque avec impertinence et humour celles et ceux qui font l’actualité.;Radio;Europe 1;;25;134;9;0;Fun;;;http/ssssssss.xml;http://is4.mzstatic.com/image/thumb/Music41/v4/ca/70/61/ca706130-6be4-4b0a-a305-07cdd8379a45/source/100x100bb.jpg;http://is4.mzstatic.com/image/thumb/Music41/v4/ca/70/61/ca706130-6be4-4b0a-a305-07cdd8379a45/source/600x600bb.jpg
371743;0;f695c8e68f88f8d4a6cebce2462003b9d7bea361;FR (FR);Le kiosque de Samuel Etienne;Elisabeth Assayag, Nicolas Carreau et Marion Calais font le point sur l'actualité du jour.;Radio;Europe 1;2017-07-07 03:45:00 UTC;25;113;11;0;Reportages Actualité;;;http://cdn2-europe1.new2.ladmedia.fr/var/exports/podcasts/sound/le-kiosque-de-samuel-etienne.xml;http://is4.mzstatic.com/image/thumb/Music42/v4/98/17/7a/98177a49-1cc3-a3f1-4325-345013f130b4/source/100x100bb.jpg;http://is4.mzstatic.com/image/thumb/Music42/v4/98/17/7a/98177a49-1cc3-a3f1-4325-345013f130b4/source/600x600bb.jpg
137740;0;58cf75deac00d4e1a91051cd8a4420be6a5325b7;FR (FR);En français dans le texte;Jonas Karlsson sur Europe 1;Radio;Europe 1;2015-06-28 13:43:00 UTC;26;105;49;0;Reportages Culturels;;;http://cdn-europe1.new2.ladmedia.fr/var/exports/podcasts/sound/nicolas-carreau.xml;http://is5.mzstatic.com/image/thumb/Music4/v4/5a/30/93/5a309351-3a6d-e487-c5b8-ea63dd428242/source/100x100bb.jpg;http://is5.mzstatic.com/image/thumb/Music4/v4/5a/30/93/5a309351-3a6d-e487-c5b8-ea63dd428242/source/600x600bb.jpg
430402;0;2811b8b0c6d63e3c18caca1ff5dbfaf2e70cac70;FR (FR);La libre antenne de Caroline Dublanche et Sophie Peters;La vie se montre parfois dure, mais Europe 1 est là. 2h30 de direct chaque soir pour mieux se comprendre, évoquer doutes et fragilités mais aussi désirs et moments de bonheur. Le climat est à la confiance, à l’apaisement et au partage d’expériences : il s’agit pour chacun de trouver en lui-même des clés pour surmonter les difficultés de l’existence. Et la vie n’est plus si difficile !;Radio;Europe 1;2018-05-14 20:30:00 UTC;30;102;0;0;Développement Personnel;Kids & Family;;http://cdn-new-europe1.ladmedia.fr/var/exports/podcasts/sound/libre-antenne.xml;https://cdn-europe1.new2.ladmedia.fr/var/europe1/storage/images/media/podcasts/la-libre-antenne-de-caroline-dublanche-et-sophie-peters/512592-10-fre-FR/La-libre-antenne-de-Caroline-Dublanche-et-Sophie-Peters.jpg;https://cdn-europe1.new2.ladmedia.fr/var/europe1/storage/images/media/podcasts/la-libre-antenne-de-caroline-dublanche-et-sophie-peters/512592-10-fre-FR/La-libre-antenne-de-Caroline-Dublanche-et-Sophie-Peters.jpg
382057;0;479a76d9a28324ee1375a1668ae2722a0cb78939;FR (FR);La revue de presque de Nicolas Canteloup;La revue de presque quotidienne de Nicolas Canteloup sur Europe 1.;Radio;Europe 1;2018-05-14 06:42:00 UTC;50;93;10;0;Fun;Games & Hobbies;;http://cdn-new-europe1.ladmedia.fr/var/exports/podcasts/sound/revue-de-presque.xml;https://cdn-europe1.new2.ladmedia.fr/var/europe1/storage/images/media/podcasts/la-revue-de-presque-de-nicolas-canteloup/511584-9-fre-FR/La-revue-de-presque-de-Nicolas-Canteloup.jpg;https://cdn-europe1.new2.ladmedia.fr/var/europe1/storage/images/media/podcasts/la-revue-de-presque-de-nicolas-canteloup/511584-9-fre-FR/La-revue-de-presque-de-Nicolas-Canteloup.jpg
573049;0;6ca00c9276c82c208fbf7a561343a3e498e7a3df;FR (FR);Au cœur de l'histoire de Franck Ferrand;Une formule enrichie pour faire revivre l’Histoire des grands personnages, voyager à travers les époques et découvrir le passé des monuments et des villes de France. #ACDH;Radio;Europe 1;2018-05-14 12:00:00 UTC;50;93;4;0;Histoire;Society & Culture;evst-user-add;http://www.europe1.fr/podcasts/au-coeur-de-l-histoire.xml;https://cdn-europe1.new2.ladmedia.fr/var/europe1/storage/images/media/podcasts/au-coeur-de-l-histoire-de-franck-ferrand/511612-9-fre-FR/Au-coeur-de-l-histoire-de-Franck-Ferrand.jpg;https://cdn-europe1.new2.ladmedia.fr/var/europe1/storage/images/media/podcasts/au-coeur-de-l-histoire-de-franck-ferrand/511612-9-fre-FR/Au-coeur-de-l-histoire-de-Franck-Ferrand.jpg
446271;0;6ad554d82083f7361d32af3b23c6f016090997aa;FR (FR);L'édito économique d'Axel de Tarlé;Axel de Tarlé s'intéresse à l'actualité économique du jour.;Radio;Europe 1;2018-05-14 05:44:00 UTC;30;87;1;0;Reportages Actualité;News & Politics;;http://cdn1-europe1.new2.ladmedia.fr/var/exports/podcasts/sound/le-journal-de-l-eco.xml;https://cdn-europe1.new2.ladmedia.fr/var/europe1/storage/images/media/podcasts/l-edito-economique-d-axel-de-tarle/511892-10-fre-FR/L-edito-economique-d-Axel-de-Tarle.jpg;https://cdn-europe1.new2.ladmedia.fr/var/europe1/storage/images/media/podcasts/l-edito-economique-d-axel-de-tarle/511892-10-fre-FR/L-edito-economique-d-Axel-de-Tarle.jpg
36969;0;832625bd7600de9be598d2eed8eef96616a253ca;FR (FR);Les secrets politiques;Toute l’actualité politique par la rédaction web et radio d’Europe 1 : les projets de loi, l'actualité du président de la République, le travail du gouvernement, la vie de l'Assemblée nationale. Les dernières infos, les enquêtes, les interviews, les analyses de nos éditorialistes.;Radio;Europe 1;2016-05-30 05:25:00 UTC;30;78;112;0;Politique;;;http://cdn-europe1.new2.ladmedia.fr/var/exports/podcasts/sound/Caroline-Roux.xml;http://is2.mzstatic.com/image/thumb/Music4/v4/f5/25/71/f52571e7-c27d-c328-2dc7-2b4a7eb69fb8/source/100x100bb.jpg;http://is2.mzstatic.com/image/thumb/Music4/v4/f5/25/71/f52571e7-c27d-c328-2dc7-2b4a7eb69fb8/source/600x600bb.jpg
378809;0;76d44dbc334356bcc215b607a129f364b9d65e87;FR (FR);La bande à Roumanoff;Les chroniques humour par La bande des chroniqueurs ;Radio;Europe 1;2017-08-18 10:00:00 UTC;30;60;23;0;Fun;;;http://cdn-europe1.new2.ladmedia.fr/var/exports/podcasts/sound/la-bande-a-roumanoff.xml;http://is3.mzstatic.com/image/thumb/Music62/v4/b3/a9/6c/b3a96c9c-6e14-bee2-09db-2161cce1c2a4/source/100x100bb.jpg;http://is3.mzstatic.com/image/thumb/Music62/v4/b3/a9/6c/b3a96c9c-6e14-bee2-09db-2161cce1c2a4/source/600x600bb.jpg
535261;0;c47907777ab02a32886a0d0b254a80f9db700559;FR (FR);L'interview de Thomas Sotto;L'interviews des personnalités ;Radio;Europe 1;2017-07-07 05:46:00 UTC;30;58;0;0;Reportages Actualité;;;http://cdn1-europe1.new2.ladmedia.fr/var/exports/podcasts/sound/L-interview-verite-Thomas-Sotto.xml;http://cdn-europe1.new2.ladmedia.fr/var/europe1/storage/images/media/podcasts/l-interview-de-thomas-sotto/519536-4-fre-FR/L-interview-de-Thomas-Sotto.jpg;http://cdn-europe1.new2.ladmedia.fr/var/europe1/storage/images/media/podcasts/l-interview-de-thomas-sotto/519536-4-fre-FR/L-interview-de-Thomas-Sotto.jpg
356486;0;abd5833974ff7eb7534ad31ba867d1a2e24cc07e;FR (FR);Culture d'été : le conseil de lecture - Nicolas Carreau;Les idées de lecture avec Nicolas Carreau;Radio;Europe 1;2017-08-25 05:40:00 UTC;30;55;2;0;Littérature;;;http://cdn3-europe1.new2.ladmedia.fr/var/exports/podcasts/sound/culture-dete-nicolas-carreau.xml;http://is5.mzstatic.com/image/thumb/Music118/v4/99/75/67/997567ac-efde-f081-6ffa-c401a65e53ee/source/100x100bb.jpg;http://is5.mzstatic.com/image/thumb/Music118/v4/99/75/67/997567ac-efde-f081-6ffa-c401a65e53ee/source/600x600bb.jpg
354685;0;9ad706ef3d6f14732d7e7e35166d2f5d9079019c;FR (FR);Le débrief de Matthieu Noël;Matthieu Noël présente son debrief d'Europe 1 midi.;Radio;Europe 1;2017-06-16 11:32:00 UTC;25;52;2;0;Fun;;;http://cdn2-europe1.new2.ladmedia.fr/var/exports/podcasts/sound/le-débrief-de-Matthieu-Noel.xml;http://cdn-europe1.new2.ladmedia.fr/var/europe1/storage/images/media/podcasts/le-debrief-de-matthieu-noel/21422539-2-fre-FR/le-debrief-de-Matthieu-Noel.jpg;http://cdn-europe1.new2.ladmedia.fr/var/europe1/storage/images/media/podcasts/le-debrief-de-matthieu-noel/21422539-2-fre-FR/le-debrief-de-Matthieu-Noel.jpg
180553;0;c7e5e6de7ff1e4c4064fd53df0416dd997dd9a6a;FR (FR);L'édito politique de Catherine Nay;Chaque semaine, l'édito politique de Catherine Nay;Radio;Europe 1;2015-06-27 06:16:00 UTC;30;46;50;0;Reportages Actualité;;;http://cdn-europe1.new2.ladmedia.fr/var/exports/podcasts/sound/l-edito-de-catherine-nay.xml;http://is1.mzstatic.com/image/thumb/Music3/v4/0c/08/f2/0c08f221-6b15-b016-c73e-ad95e1f74bf5/source/100x100bb.jpg;http://is1.mzstatic.com/image/thumb/Music3/v4/0c/08/f2/0c08f221-6b15-b016-c73e-ad95e1f74bf5/source/600x600bb.jpg
307507;0;1bc42e5d2e9bcf76828c420bf84938f5c4a47a53;FR (FR);L'histoire vraie... ou pas ! de Pierre Bellemare;Tous les jours, Pierre Bellemare vous fait part d'une histoire incroyable. Est-elle vraie? Est-elle fausse? À vous de le découvrir;Radio;Europe 1;2015-06-16 22:00:00 UTC;30;45;30;0;Fun;;;http://cdn3-europe1.new2.ladmedia.fr/var/exports/podcasts/sound/Les-histoires-de-Pierre-Bellemare.xml;http://cdn-europe1.new2.ladmedia.fr/var/europe1/storage/images/media/podcasts/l-histoire-vraie-ou-pas-de-pierre-bellemare/519760-1-fre-FR/L-histoire-vraie-ou-pas-!-de-Pierre-Bellemare.jpg;http://cdn-europe1.new2.ladmedia.fr/var/europe1/storage/images/media/podcasts/l-histoire-vraie-ou-pas-de-pierre-bellemare/519760-1-fre-FR/L-histoire-vraie-ou-pas-!-de-Pierre-Bellemare.jpg
393576;0;326d26dff9d88ac7f4b2b84087bb405fe6fb707b;FR (FR);Europe 1 - L'interview d'Europe 1 Soir;Chaque matin, retrouvez l'interview de la Matinale à 8h15.;Radio;Europe 1;2018-05-14 09:20:37 UTC;1;42;48;0;Reportages Actualité;News & Politics;evst-user-add;http://cdn-europe1.new2.ladmedia.fr/var/exports/podcasts/sound/l-interview-de-claude-askolovitch.xml;https://cdn-europe1.new2.ladmedia.fr/var/europe1/storage/images/media/podcasts/europe-1-l-interview-d-europe-1-soir/514384-1-fre-FR/Europe-1-L-interview-d-Europe-1-Soir.jpg;https://cdn-europe1.new2.ladmedia.fr/var/europe1/storage/images/media/podcasts/europe-1-l-interview-d-europe-1-soir/514384-1-fre-FR/Europe-1-L-interview-d-Europe-1-Soir.jpg
138621;0;cf3a9eb0b0830dca805ea9df5406643f1d840775;FR (FR);Europe 1 vous répond;Europe 1 repond à toutes vos questions ;Radio;Europe 1;2016-08-19 04:47:00 UTC;30;36;80;0;Reportages Actualité;;;http://cdn-europe1.new2.ladmedia.fr/var/exports/podcasts/sound/Europe-1-vous-repond.xml;http://is5.mzstatic.com/image/thumb/Music69/v4/86/8d/1d/868d1dd4-02de-bef7-589b-07b0165cdf01/source/100x100bb.jpg;http://is5.mzstatic.com/image/thumb/Music69/v4/86/8d/1d/868d1dd4-02de-bef7-589b-07b0165cdf01/source/600x600bb.jpg
399276;0;368152d4614d2c49a9f3770045d237809da51559;FR (FR);Le débat éco;Le debat économique par Agnès VERDIER-MOLINIE;Radio;Europe 1;2017-07-09 05:44:00 UTC;30;36;1;0;Reportages Actualité;;;http://cdn2-europe1.new2.ladmedia.fr/var/exports/podcasts/sound/le-debat-eco.xml;http://cdn-europe1.new2.ladmedia.fr/var/europe1/storage/images/media/podcasts/le-debat-eco/521748-4-fre-FR/Le-debat-eco.jpg;http://cdn-europe1.new2.ladmedia.fr/var/europe1/storage/images/media/podcasts/le-debat-eco/521748-4-fre-FR/Le-debat-eco.jpg
374924;0;5faa17e3892fbffee1260f054bf1738a31bfd885;FR (FR);L'édito du JDD;L'edito du JDD est une chronique de l'emission europe 1 week-end;Radio;Europe 1;2018-05-13 06:17:00 UTC;30;34;14;0;Reportages Actualité;News & Politics;;http://cdn-europe1.new2.ladmedia.fr/var/exports/podcasts/sound/ledito-du-jdd.xml;https://is3-ssl.mzstatic.com/image/thumb/Music118/v4/1b/4a/7d/1b4a7d70-90a4-c82f-b9b5-4e28c884e5dd/source/100x100bb.jpg;https://is3-ssl.mzstatic.com/image/thumb/Music118/v4/1b/4a/7d/1b4a7d70-90a4-c82f-b9b5-4e28c884e5dd/source/600x600bb.jpg
215638;0;3a6d5ab8322ebcc1423633e328c3f2610cd7b04d;FR (FR);Culture et découverte;Tous les matins, découvrez le coup de cœur culturel de Pierre De Vilno ainsi que le coup de cœur télé de Marion Calais.;Radio;Europe 1;2016-07-08 03:24:00 UTC;30;33;18;0;Reportages Culturels;;;http://cdn-europe1.new2.ladmedia.fr/var/exports/podcasts/sound/culture-et-decouverte.xml;http://is1.mzstatic.com/image/thumb/Music7/v4/76/c7/b2/76c7b23c-c597-d37a-f684-2cbc7178e927/source/100x100bb.jpg;http://is1.mzstatic.com/image/thumb/Music7/v4/76/c7/b2/76c7b23c-c597-d37a-f684-2cbc7178e927/source/600x600bb.jpg
1087432;0;440db7fbafb58c9881c241c39e50e0c5508ceb8f;FR (FR);Rien ne s'oppose à Guy Carlier;Rien ne s'oppose à Guy Carlier est une chronique de l'émission rien de s'oppose à midi;Radio;Europe 1;2018-05-14 10:21:00 UTC;30;32;7;0;Jeux;Games & Hobbies;evst-user-add,evst-review-passed;http://cdn2-europe1.new2.ladmedia.fr/var/exports/podcasts/sound/guy-carlier---europe-1.xml;https://cdn-europe1.new2.ladmedia.fr/var/europe1/storage/images/media/podcasts/rien-ne-s-oppose-a-guy-carlier/28735765-7-fre-FR/Rien-ne-s-oppose-a-Guy-Carlier.jpg;https://cdn-europe1.new2.ladmedia.fr/var/europe1/storage/images/media/podcasts/rien-ne-s-oppose-a-guy-carlier/28735765-7-fre-FR/Rien-ne-s-oppose-a-Guy-Carlier.jpg
374432;0;8a78e503d343a55b762a19103d408812d765a920;FR (FR);Europe 1 - L'édito politique;L'édito politique  d'Hélène Jouan est une chronique de l'émission Europe Matin ;Radio;Europe 1;2015-06-27 06:16:00 UTC;30;31;26;0;Reportages Actualité;;;http://cdn-europe1.new2.ladmedia.fr/var/exports/podcasts/sound/edito-politique.xml;http://is3.mzstatic.com/image/thumb/Music62/v4/60/61/32/6061328e-9e83-c1bb-54a2-e7b696397e00/source/100x100bb.jpg;http://is3.mzstatic.com/image/thumb/Music62/v4/60/61/32/6061328e-9e83-c1bb-54a2-e7b696397e00/source/600x600bb.jpg
356042;0;2d39e479ab9754aa1d0529750361b3fe76435302;FR (FR);La région du jour;Le grand direct des régions présenté par Olivier Alleman & PIERRE BONTE ;Radio;Europe 1;2016-08-19 08:19:00 UTC;29;28;2;0;Reportages Culturels;;;http://cdn-europe1.new2.ladmedia.fr/var/exports/podcasts/sound/la-region-du-jour.xml;http://is1.mzstatic.com/image/thumb/Music60/v4/30/cf/1a/30cf1aca-b203-db5f-b815-e696b22619e9/source/100x100bb.jpg;http://is1.mzstatic.com/image/thumb/Music60/v4/30/cf/1a/30cf1aca-b203-db5f-b815-e696b22619e9/source/600x600bb.jpg
201098;0;1dde84615ddbdd5f53b3b7b25195a856b0a59ad0;FR (FR);Le club de la presse étrangère;Le Club de la presse étrangère présenté par Sophie LARMOYER ;Radio;Europe 1;2018-01-05 17:45:00 UTC;25;27;19;0;Reportages Actualité;;;http://cdn-europe1.new2.ladmedia.fr/var/exports/podcasts/sound/le-club-de-la-presse-etrangere.xml;http://is3.mzstatic.com/image/thumb/Music62/v4/41/d7/63/41d7637a-5c5a-e395-dc01-ce91319f6511/source/100x100bb.jpg;http://is3.mzstatic.com/image/thumb/Music62/v4/41/d7/63/41d7637a-5c5a-e395-dc01-ce91319f6511/source/600x600bb.jpg
211411;0;9cea842408ed90545967017e90eefe69ea99d0c8;FR (FR);L'innovation du jour;La chronique Innovation de Maxime Switek.;Radio;Europe 1;2015-07-10 04:40:00 UTC;30;24;29;0;Technologie;;;http://cdn-europe1.new2.ladmedia.fr/var/exports/podcasts/sound/sandra-freeman.xml;http://is1.mzstatic.com/image/thumb/Music3/v4/41/07/fc/4107fc80-2963-d51c-1a9d-4afad55705d6/source/100x100bb.jpg;http://is1.mzstatic.com/image/thumb/Music3/v4/41/07/fc/4107fc80-2963-d51c-1a9d-4afad55705d6/source/600x600bb.jpg
233043;0;e580fc1219fcd92f7c54ffbd850d72ea04db4933;FR (FR);La sortie du jour;La sortie du jour par Jean-Philipe-Balasse sur Europe 1;Radio;Europe 1;2015-07-10 06:55:00 UTC;30;24;1;0;Reportages Culturels;;;http://cdn-europe1.new2.ladmedia.fr/var/exports/podcasts/sound/le-choix-culturel.xml;http://is3.mzstatic.com/image/thumb/Music62/v4/c3/f8/cc/c3f8cc6d-a480-cbb3-9faa-e05dea0b9dfc/source/100x100bb.jpg;http://is3.mzstatic.com/image/thumb/Music62/v4/c3/f8/cc/c3f8cc6d-a480-cbb3-9faa-e05dea0b9dfc/source/600x600bb.jpg
530340;0;38dd6a2f67f699f334a5fe724dfe472444052fdc;FR (FR);Un dimanche de cinéma;Mathieu Charrier passe en revue l'actualité du septième art : les films à l’affiche, ceux à venir, les coups de cœurs, les projets et les tournages. ;Radio;Europe 1;2018-05-13 13:00:00 UTC;30;20;3;0;Reportages Culturels;Society & Culture;evst-user-add;http://cdn2-europe1.new2.ladmedia.fr/var/exports/podcasts/sound/un-dimanche-de-cinema.xml;https://cdn-europe1.new2.ladmedia.fr/var/europe1/storage/images/media/podcasts/un-dimanche-de-cinema/28599754-7-fre-FR/Un-dimanche-de-cinema.jpg;https://cdn-europe1.new2.ladmedia.fr/var/europe1/storage/images/media/podcasts/un-dimanche-de-cinema/28599754-7-fre-FR/Un-dimanche-de-cinema.jpg
374927;0;dffa8742aacb804807bd7f4deb23996cbb9c34ae;FR (FR);En route pour la Maison-Blanche;Les actualités politiques des Etats-Unis par Xavier Yvon;Radio;Europe 1;2016-11-11 17:47:00 UTC;25;20;0;0;Reportages Actualité;;;http://cdn-europe1.new2.ladmedia.fr/var/exports/podcasts/sound/en-route-pour-la-maison-blanche.xml;http://is1.mzstatic.com/image/thumb/Music71/v4/9c/14/5c/9c145c7f-ce57-7c87-b7ef-3d68c3f73ef0/source/100x100bb.jpg;http://is1.mzstatic.com/image/thumb/Music71/v4/9c/14/5c/9c145c7f-ce57-7c87-b7ef-3d68c3f73ef0/source/600x600bb.jpg
159476;0;49223cee13d287d70dcf4a249975e9adce337817;FR (FR);Les grandes voix vous répondent;Sonia Mabrouk et les voix historiques d’Europe 1 analysent et débattent de l’actualité;Radio;Europe 1;2016-06-19 17:00:00 UTC;23;19;55;0;Reportages Actualité;;;http://cdn-europe1.new2.ladmedia.fr/var/exports/podcasts/sound/les-grandes-voix-vous-repondent.xml;http://is5.mzstatic.com/image/thumb/Music49/v4/12/62/2e/12622ee9-9341-c8da-8bf5-1caac5289737/source/100x100bb.jpg;http://is5.mzstatic.com/image/thumb/Music49/v4/12/62/2e/12622ee9-9341-c8da-8bf5-1caac5289737/source/600x600bb.jpg
342962;0;4fc510e59a3bfcc4459bc3235a8dcad0d5170356;FR (FR);Dany Football Club;Ici, on parle de foot sous un angle sociétal avec Jean Réveillon,  JP Naugrette, Laurent Jaoui et Delphine Denuit.;Radio;Europe 1;2016-07-10 18:00:00 UTC;23;19;8;0;Sport;;;http://cdn-europe1.new2.ladmedia.fr/var/exports/podcasts/sound/dany-football-club.xml;http://is5.mzstatic.com/image/thumb/Music60/v4/68/17/b8/6817b844-c004-ced8-e2d3-1c003618325c/source/100x100bb.jpg;http://is5.mzstatic.com/image/thumb/Music60/v4/68/17/b8/6817b844-c004-ced8-e2d3-1c003618325c/source/600x600bb.jpg
569583;0;036c355baee2e07c9c6cc226476eca7d10223127;FR (FR);Le grand destin - Franck Ferrand;Franck Ferrand nous racontent les grands destins de compositeurs, d'écrivains… Leurs parcours et leurs histoires;Radio;Europe 1;2016-10-01 12:50:00 UTC;25;18;13;0;Portraits;;;http://cdn1-europe1.new2.ladmedia.fr/var/exports/podcasts/sound/le-grand-destin---franck-ferrand.xml;http://cdn-europe1.new2.ladmedia.fr/var/europe1/storage/images/media/podcasts/le-grand-destin-franck-ferrand/28635025-4-fre-FR/Le-grand-destin-Franck-Ferrand.jpg;http://cdn-europe1.new2.ladmedia.fr/var/europe1/storage/images/media/podcasts/le-grand-destin-franck-ferrand/28635025-4-fre-FR/Le-grand-destin-Franck-Ferrand.jpg
334745;0;a26897058f8b961f30694f66f4a9f7c8ca999624;FR (FR);Les découvertes d'Europe midi;Retrouvez la bande des chroniqueurs culturels du jour : Eva Roque pour la TV, Benjamin Josse et mercredi rime avec sorties ciné aussi par conséquent avec Bruno Cras !;Radio;Europe 1;2016-07-08 11:40:00 UTC;30;18;9;0;Reportages Culturels;;;http://cdn-europe1.new2.ladmedia.fr/var/exports/podcasts/sound/les-decouvertes-deurope-midi.xml;http://is2.mzstatic.com/image/thumb/Music18/v4/14/6a/bf/146abfe4-d758-704f-939d-c1cd57527de4/source/100x100bb.jpg;http://is2.mzstatic.com/image/thumb/Music18/v4/14/6a/bf/146abfe4-d758-704f-939d-c1cd57527de4/source/600x600bb.jpg
